{
  "generated_at": "2026-07-21T14:35:05",
  "count": 12,
  "report_dir": "docs",
  "dimension_count": 11,
  "batch_count": 127,
  "dimensions": [
    {
      "key": "research_line",
      "label": "研究线",
      "query": "line",
      "multi": false,
      "paper_key": "research_line"
    },
    {
      "key": "line_role",
      "label": "研究角色",
      "query": "role",
      "multi": false,
      "paper_key": "line_role"
    },
    {
      "key": "domain",
      "label": "Domain",
      "query": "domain",
      "multi": true,
      "paper_key": "domains"
    },
    {
      "key": "track",
      "label": "Track",
      "query": "track",
      "multi": true,
      "paper_key": "tracks"
    },
    {
      "key": "problem",
      "label": "Problem",
      "query": "problem",
      "multi": true,
      "paper_key": "problems"
    },
    {
      "key": "topic",
      "label": "Topic",
      "query": "topic",
      "multi": true,
      "paper_key": "topics"
    },
    {
      "key": "method",
      "label": "Method",
      "query": "method",
      "multi": true,
      "paper_key": "methods"
    },
    {
      "key": "status",
      "label": "Status",
      "query": "status",
      "multi": false,
      "paper_key": "status"
    },
    {
      "key": "reading_stage",
      "label": "Reading stage",
      "query": "stage",
      "multi": false,
      "paper_key": "reading_stage"
    },
    {
      "key": "review_stage",
      "label": "Review stage",
      "query": "reviewStage",
      "multi": false,
      "paper_key": "review_stage"
    },
    {
      "key": "code",
      "label": "Code",
      "query": "code",
      "multi": false,
      "paper_key": "has_code"
    }
  ],
  "summary": {
    "high": 127,
    "medium": 0,
    "low": 0,
    "missing_review": 229,
    "missing_taxonomy": 50
  },
  "batches": [
    {
      "id": "review_stage::未设置",
      "dimension": "review_stage",
      "dimension_label": "Review stage",
      "value": "未设置",
      "count": 12,
      "severity": "high",
      "priority": 171,
      "latest_year": 2026,
      "high_importance": 2,
      "missing_review": 12,
      "due_review": 0,
      "missing_taxonomy": 3,
      "no_code": 4,
      "recommended_action": "补 next_review 12 篇",
      "href": "library.html",
      "export_command": "",
      "slugs": [
        "2307.08691-flashattention-2",
        "2501.01005-flashinfer",
        "2503.14075-twigvlm-plus-plus",
        "2507.11851-llm-future-mtp",
        "2512.23424-akg-kernel-agent-multi",
        "2602.06036-dflash",
        "2603.03251-speculative-speculative-decoding",
        "2604.11035-introspective-dlm",
        "2605.12825-orthrus",
        "2607.00466-eldr",
        "noarxiv-2026-dspark",
        "semantic-search-evaluation"
      ],
      "sample_slugs": [
        "2604.11035-introspective-dlm",
        "2307.08691-flashattention-2",
        "2602.06036-dflash",
        "noarxiv-2026-dspark",
        "2607.00466-eldr",
        "2503.14075-twigvlm-plus-plus"
      ],
      "sample_titles": [
        "内省式扩散语言模型",
        "FlashAttention-2：用更好的并行性与工作划分加速 Attention",
        "DFlash：用于快速 speculative decoding 的块扩散方法",
        "DSpark：基于置信度调度的半自回归 speculative decoding",
        "ELDR：面向 PD 分离 MoE 服务的专家局部性感知解码路由",
        "通过蒸馏与强化学习生长多头 Twig 以加速大型视觉语言模型"
      ]
    },
    {
      "id": "status::read",
      "dimension": "status",
      "dimension_label": "Status",
      "value": "read",
      "count": 12,
      "severity": "high",
      "priority": 171,
      "latest_year": 2026,
      "high_importance": 2,
      "missing_review": 12,
      "due_review": 0,
      "missing_taxonomy": 3,
      "no_code": 4,
      "recommended_action": "补 next_review 12 篇",
      "href": "library.html?status=read",
      "export_command": "python3 scripts/export_reading_list.py docs --status read --output docs/exports/status-read-reading-list.md",
      "slugs": [
        "2307.08691-flashattention-2",
        "2501.01005-flashinfer",
        "2503.14075-twigvlm-plus-plus",
        "2507.11851-llm-future-mtp",
        "2512.23424-akg-kernel-agent-multi",
        "2602.06036-dflash",
        "2603.03251-speculative-speculative-decoding",
        "2604.11035-introspective-dlm",
        "2605.12825-orthrus",
        "2607.00466-eldr",
        "noarxiv-2026-dspark",
        "semantic-search-evaluation"
      ],
      "sample_slugs": [
        "2604.11035-introspective-dlm",
        "2307.08691-flashattention-2",
        "2602.06036-dflash",
        "noarxiv-2026-dspark",
        "2607.00466-eldr",
        "2503.14075-twigvlm-plus-plus"
      ],
      "sample_titles": [
        "内省式扩散语言模型",
        "FlashAttention-2：用更好的并行性与工作划分加速 Attention",
        "DFlash：用于快速 speculative decoding 的块扩散方法",
        "DSpark：基于置信度调度的半自回归 speculative decoding",
        "ELDR：面向 PD 分离 MoE 服务的专家局部性感知解码路由",
        "通过蒸馏与强化学习生长多头 Twig 以加速大型视觉语言模型"
      ]
    },
    {
      "id": "code::yes",
      "dimension": "code",
      "dimension_label": "Code",
      "value": "yes",
      "count": 8,
      "severity": "high",
      "priority": 141,
      "latest_year": 2026,
      "high_importance": 2,
      "missing_review": 8,
      "due_review": 0,
      "missing_taxonomy": 1,
      "no_code": 0,
      "recommended_action": "补 next_review 8 篇",
      "href": "library.html?code=yes",
      "export_command": "",
      "slugs": [
        "2307.08691-flashattention-2",
        "2501.01005-flashinfer",
        "2503.14075-twigvlm-plus-plus",
        "2602.06036-dflash",
        "2603.03251-speculative-speculative-decoding",
        "2604.11035-introspective-dlm",
        "2605.12825-orthrus",
        "noarxiv-2026-dspark"
      ],
      "sample_slugs": [
        "2604.11035-introspective-dlm",
        "2307.08691-flashattention-2",
        "2602.06036-dflash",
        "noarxiv-2026-dspark",
        "2503.14075-twigvlm-plus-plus",
        "2605.12825-orthrus"
      ],
      "sample_titles": [
        "内省式扩散语言模型",
        "FlashAttention-2：用更好的并行性与工作划分加速 Attention",
        "DFlash：用于快速 speculative decoding 的块扩散方法",
        "DSpark：基于置信度调度的半自回归 speculative decoding",
        "通过蒸馏与强化学习生长多头 Twig 以加速大型视觉语言模型",
        "Orthrus：通过双视角扩散实现内存高效的并行 token 生成"
      ]
    },
    {
      "id": "domain::LLM Systems",
      "dimension": "domain",
      "dimension_label": "Domain",
      "value": "LLM Systems",
      "count": 9,
      "severity": "high",
      "priority": 141,
      "latest_year": 2026,
      "high_importance": 2,
      "missing_review": 9,
      "due_review": 0,
      "missing_taxonomy": 0,
      "no_code": 2,
      "recommended_action": "补 next_review 9 篇",
      "href": "library.html?domain=LLM+Systems",
      "export_command": "",
      "slugs": [
        "2307.08691-flashattention-2",
        "2501.01005-flashinfer",
        "2503.14075-twigvlm-plus-plus",
        "2507.11851-llm-future-mtp",
        "2602.06036-dflash",
        "2604.11035-introspective-dlm",
        "2605.12825-orthrus",
        "2607.00466-eldr",
        "noarxiv-2026-dspark"
      ],
      "sample_slugs": [
        "2604.11035-introspective-dlm",
        "2307.08691-flashattention-2",
        "2602.06036-dflash",
        "noarxiv-2026-dspark",
        "2607.00466-eldr",
        "2503.14075-twigvlm-plus-plus"
      ],
      "sample_titles": [
        "内省式扩散语言模型",
        "FlashAttention-2：用更好的并行性与工作划分加速 Attention",
        "DFlash：用于快速 speculative decoding 的块扩散方法",
        "DSpark：基于置信度调度的半自回归 speculative decoding",
        "ELDR：面向 PD 分离 MoE 服务的专家局部性感知解码路由",
        "通过蒸馏与强化学习生长多头 Twig 以加速大型视觉语言模型"
      ]
    },
    {
      "id": "topic::Speculative Decoding",
      "dimension": "topic",
      "dimension_label": "Topic",
      "value": "Speculative Decoding",
      "count": 7,
      "severity": "high",
      "priority": 133,
      "latest_year": 2026,
      "high_importance": 1,
      "missing_review": 7,
      "due_review": 0,
      "missing_taxonomy": 1,
      "no_code": 1,
      "recommended_action": "补 next_review 7 篇",
      "href": "library.html?topic=Speculative+Decoding",
      "export_command": "python3 scripts/export_reading_list.py docs --topic 'Speculative Decoding' --output docs/exports/topic-speculative-decoding-reading-list.md",
      "slugs": [
        "2503.14075-twigvlm-plus-plus",
        "2507.11851-llm-future-mtp",
        "2602.06036-dflash",
        "2603.03251-speculative-speculative-decoding",
        "2604.11035-introspective-dlm",
        "2605.12825-orthrus",
        "noarxiv-2026-dspark"
      ],
      "sample_slugs": [
        "2604.11035-introspective-dlm",
        "2602.06036-dflash",
        "noarxiv-2026-dspark",
        "2503.14075-twigvlm-plus-plus",
        "2605.12825-orthrus",
        "2603.03251-speculative-speculative-decoding"
      ],
      "sample_titles": [
        "内省式扩散语言模型",
        "DFlash：用于快速 speculative decoding 的块扩散方法",
        "DSpark：基于置信度调度的半自回归 speculative decoding",
        "通过蒸馏与强化学习生长多头 Twig 以加速大型视觉语言模型",
        "Orthrus：通过双视角扩散实现内存高效的并行 token 生成",
        "推测性推测解码"
      ]
    },
    {
      "id": "reading_stage::deep_read",
      "dimension": "reading_stage",
      "dimension_label": "Reading stage",
      "value": "deep_read",
      "count": 7,
      "severity": "high",
      "priority": 131,
      "latest_year": 2026,
      "high_importance": 2,
      "missing_review": 7,
      "due_review": 0,
      "missing_taxonomy": 0,
      "no_code": 2,
      "recommended_action": "补 next_review 7 篇",
      "href": "library.html?stage=deep_read",
      "export_command": "",
      "slugs": [
        "2307.08691-flashattention-2",
        "2501.01005-flashinfer",
        "2507.11851-llm-future-mtp",
        "2602.06036-dflash",
        "2604.11035-introspective-dlm",
        "2605.12825-orthrus",
        "2607.00466-eldr"
      ],
      "sample_slugs": [
        "2604.11035-introspective-dlm",
        "2307.08691-flashattention-2",
        "2602.06036-dflash",
        "2607.00466-eldr",
        "2605.12825-orthrus",
        "2501.01005-flashinfer"
      ],